{
  "schema": "runtime-receipt-request/v1",
  "repository": "mochan-tk/agentic-dev-kit-for-codex",
  "task": {
    "issue": 25,
    "url": "https://github.com/mochan-tk/agentic-dev-kit-for-codex/issues/25"
  },
  "pull_request": {
    "number": 73,
    "url": "https://github.com/mochan-tk/agentic-dev-kit-for-codex/pull/73",
    "head": "aaaaaaaaaaaaaaaaaaaaaaaaaaaaaaaaaaaaaaaa",
    "tree": "bbbbbbbbbbbbbbbbbbbbbbbbbbbbbbbbbbbbbbbb"
  },
  "artifacts": {
    "runtime_profile": {
      "schema": "runtime-profile/v1",
      "repository": "mochan-tk/agentic-dev-kit-for-codex",
      "observed_at": "2026-08-28T00:00:00Z",
      "scope": "exact-head-live-sensor",
      "status": "match",
      "reason": "stable client and all reviewed semantic capability probes match",
      "platform": {
        "os": "Linux",
        "architecture": "aarch64"
      },
      "client": {
        "version_output": "codex-cli 0.150.1",
        "release_class": "stable",
        "binary_sha256": "aaaaaaaaaaaaaaaaaaaaaaaaaaaaaaaaaaaaaaaaaaaaaaaaaaaaaaaaaaaaaaaa",
        "exec_help_sha256": "bbbbbbbbbbbbbbbbbbbbbbbbbbbbbbbbbbbbbbbbbbbbbbbbbbbbbbbbbbbbbbbb",
        "resolved_path_recorded": false
      },
      "capabilities": {
        "exec_json": true,
        "ephemeral": true,
        "strict_config": true,
        "ignore_user_config": true,
        "workspace_write": true,
        "approval_never": true,
        "documented_config_keys_probe": "pass",
        "shell_environment_probe": "pass",
        "process_cleanup_probe": "pass",
        "model": true,
        "reasoning": true,
        "sandbox": true,
        "approval": true,
        "overrides": true
      },
      "evidence": {
        "configuration_intent": {
          "schema": "t11-runtime-configuration-intent/v1",
          "authority": "adapter-authored",
          "effective_configuration_proven": false,
          "configuration_sha256": "57544f913162c855183d171f4217d9c1ad4f1a9a6d63f4539245ca8a73e16889",
          "rules_profile_sha256": "5b35a6d5cb6bb79458229743019b9fce9cce3478de0c3692388482f15aefe9c2",
          "dynamic_environment_values_excluded": [
            "CODEX_HOME",
            "HOME",
            "PATH",
            "TMPDIR"
          ],
          "reviewed_codex_source_commit": "90854393966b21e9ebfd21b122334eb09a20c93d",
          "reviewed_codex_source_blobs": {
            "debug_sandbox": "06c133394b408d4700a82bd88ddd6b8cf01ffd79",
            "spawn": "bbae9308d7e8483476887cb1a1e82555001be06c",
            "shell_environment": "e8bdaa40ca63c29ee23111252a04165e0f1f528e"
          },
          "compatibility_contract_sha256": "a28fedd4f0ecbc21d9c6f8947ba11c4464686c5946bfd6f4be8909f91846eef4",
          "reviewed_codex_injected_keys_sha256": "8ef011e3681e8a597c368d97b2dcc36e9a4c75ec9260d11a2fd5c05f26129ea6"
        },
        "diagnostic_health": {
          "classification": "diagnostic-only",
          "status": "pass",
          "checks": [
            {
              "id": "auth.credentials",
              "category": "auth",
              "status": "ok"
            },
            {
              "id": "config.load",
              "category": "config",
              "status": "ok"
            },
            {
              "id": "runtime.provenance",
              "category": "runtime",
              "status": "ok"
            },
            {
              "id": "sandbox.helpers",
              "category": "sandbox",
              "status": "ok"
            }
          ],
          "codex_issued_effective_configuration_proof": false
        },
        "exact_worker_argv": {
          "status": "pass",
          "stage": "argv-policy",
          "reason_code": "none",
          "rules_bypass_absent": true,
          "dynamic_task_data_stdin_only": true
        },
        "shell_environment_behavior": {
          "schema": "t11-shell-environment-evidence/v2",
          "authority": "adapter-authored",
          "status": "pass",
          "reason_code": "none",
          "environment_predicate": {
            "schema": "t11-shell-environment-evidence/v1",
            "authority": "adapter-authored",
            "status": "pass",
            "reason_code": "none",
            "unexpected_key_count": 0,
            "unexpected_key_names_sha256": "37517e5f3dc66819f61f5a7bb8ace1921282415f10551d2defa5c3eb0985b570",
            "secret_shaped_key_count": 0
          },
          "source_contract_sha256": "a28fedd4f0ecbc21d9c6f8947ba11c4464686c5946bfd6f4be8909f91846eef4",
          "launcher": {
            "status": "pass",
            "path_binding_stable": true,
            "binary_sha256": "ae27935781511400c65ebcc0b4669775d602f46251b8707c947a1ac1b160c1c8",
            "help_sha256": "2e2d9c7637f0e032a23cb86705bf9a82946451916e8583aa50ccc8e943c4b15d",
            "help_required_flags": true,
            "actual_image_observed": true,
            "image_samples": 2,
            "image_error_count": 0
          },
          "observation_binding": {
            "head": "aaaaaaaaaaaaaaaaaaaaaaaaaaaaaaaaaaaaaaaa",
            "tree": "bbbbbbbbbbbbbbbbbbbbbbbbbbbbbbbbbbbbbbbb",
            "provider_attempt_sha256": "20e9cf28dd4a272b7d6135e13df4ad5c0981d506c1e67da2618ab8994ada215e",
            "observation_id_sha256": "3333333333333333333333333333333333333333333333333333333333333333"
          },
          "window": {
            "started_ms": 1787875199000,
            "capture_started_ms": 1787875199100,
            "capture_finished_ms": 1787875199200,
            "classified_ms": 1787875199200
          },
          "pwd_present": true,
          "pwd_matches_exact_cwd": true
        },
        "network_sandbox_behavior": {
          "schema": "t11-network-sandbox-evidence/v2",
          "authority": "adapter-authored",
          "status": "pass",
          "reason_code": "none",
          "proof_path": "connect-denial",
          "observation": {
            "binding": {
              "head": "aaaaaaaaaaaaaaaaaaaaaaaaaaaaaaaaaaaaaaaa",
              "tree": "bbbbbbbbbbbbbbbbbbbbbbbbbbbbbbbbbbbbbbbb",
              "provider_attempt_sha256": "20e9cf28dd4a272b7d6135e13df4ad5c0981d506c1e67da2618ab8994ada215e",
              "observation_id_sha256": "3333333333333333333333333333333333333333333333333333333333333333"
            },
            "control_connected": true,
            "control_accepted": true,
            "control_peer_matches": true,
            "control_closed": true,
            "parent_netns_sha256": "1111111111111111111111111111111111111111111111111111111111111111",
            "sandbox_netns_sha256": "2222222222222222222222222222222222222222222222222222222222222222",
            "network_marker_status": "exact-1",
            "socket_create_status": "created",
            "socket_create_errno": "none",
            "connect_status": "denied",
            "connect_errno": "EPERM",
            "socket_close_status": "pass",
            "exit_code": 0,
            "signal": null,
            "timed_out": false,
            "stdout_overflow": false,
            "stderr_overflow": false,
            "stderr_size": 0,
            "reaped": true,
            "control_closed_ms": 1787875199300,
            "probe_started_ms": 1787875199400,
            "probe_finished_ms": 1787875199500
          },
          "context": {
            "expected_binding": {
              "head": "aaaaaaaaaaaaaaaaaaaaaaaaaaaaaaaaaaaaaaaa",
              "tree": "bbbbbbbbbbbbbbbbbbbbbbbbbbbbbbbbbbbbbbbb",
              "provider_attempt_sha256": "20e9cf28dd4a272b7d6135e13df4ad5c0981d506c1e67da2618ab8994ada215e",
              "observation_id_sha256": "3333333333333333333333333333333333333333333333333333333333333333"
            },
            "control_binding": {
              "head": "aaaaaaaaaaaaaaaaaaaaaaaaaaaaaaaaaaaaaaaa",
              "tree": "bbbbbbbbbbbbbbbbbbbbbbbbbbbbbbbbbbbbbbbb",
              "provider_attempt_sha256": "20e9cf28dd4a272b7d6135e13df4ad5c0981d506c1e67da2618ab8994ada215e",
              "observation_id_sha256": "3333333333333333333333333333333333333333333333333333333333333333"
            },
            "capture_binding": {
              "head": "aaaaaaaaaaaaaaaaaaaaaaaaaaaaaaaaaaaaaaaa",
              "tree": "bbbbbbbbbbbbbbbbbbbbbbbbbbbbbbbbbbbbbbbb",
              "provider_attempt_sha256": "20e9cf28dd4a272b7d6135e13df4ad5c0981d506c1e67da2618ab8994ada215e",
              "observation_id_sha256": "3333333333333333333333333333333333333333333333333333333333333333"
            },
            "observation_started_ms": 1787875199000,
            "observation_finished_ms": 1787875199500
          },
          "classified_at_ms": 1787875199500
        },
        "bubblewrap_prerequisite": {
          "schema": "t11-bubblewrap-prerequisite-evidence/v1",
          "authority": "adapter/owner-authored",
          "status": "pass",
          "reason_code": "none",
          "guest": {
            "distribution_id": "ubuntu",
            "distribution_version": "24.04",
            "distribution_codename": "noble",
            "kernel": "6.8.0-fixture",
            "architecture": "aarch64"
          },
          "apparmor": {
            "enabled": true,
            "unprivileged_userns_restriction": "active",
            "profile_required": true,
            "profile_source": "ubuntu-noble-apparmor-profiles",
            "source_sha256": "11d39094f044f0cda0febb3ad517b830301da6b2ce929664af09ee9e4dd264f9",
            "installed_sha256": "11d39094f044f0cda0febb3ad517b830301da6b2ce929664af09ee9e4dd264f9",
            "load_status": "enforce"
          },
          "bubblewrap": {
            "package_name": "bubblewrap",
            "package_version": "0.9.0-1ubuntu0.1",
            "package_architecture": "arm64",
            "install_status": "installed",
            "binary_sha256": "ae27935781511400c65ebcc0b4669775d602f46251b8707c947a1ac1b160c1c8",
            "version_output": "bubblewrap 0.9.0",